{
  "meta": {
    "worktrace_version": "0.1.0",
    "schema_version": "WorkTrace Artifact Schema",
    "project_name": "E-commerce Growth Agent Studio",
    "product_name": "运动相机",
    "workflow_version": "V2"
  },
  "trace_summary": {
    "trace_id": null,
    "trace_id_status": "historical_not_available",
    "artifact_trace_key": "historical_artifact_trace_534a02a2ce551ed2",
    "trace_type": "historical_artifact_trace",
    "execution_context": "retrospective_artifact_reconstruction",
    "workflow_status": "needs_review",
    "time_status": "historical_not_available",
    "started_at": null,
    "completed_at": null,
    "duration_ms": null,
    "retry_count": null,
    "retry_count_status": "historical_not_available",
    "source_artifacts": [
      {
        "path": "docs/worktrace_spec.md",
        "exists": true,
        "evidence_type": "artifact_derived",
        "artifact_type": "markdown",
        "required": true,
        "json_pointer": null,
        "section_hint": null,
        "role": "evidence",
        "source_status": null,
        "notes": "Source artifact for retrospective WorkTrace reconstruction."
      },
      {
        "path": "schemas/artifacts/worktrace.schema.json",
        "exists": true,
        "evidence_type": "artifact_derived",
        "artifact_type": "json",
        "required": true,
        "json_pointer": null,
        "section_hint": null,
        "role": "evidence",
        "source_status": null,
        "notes": "Schema used for Ajv validation."
      },
      {
        "path": "outputs/workflow_execution_log.json",
        "exists": true,
        "evidence_type": "artifact_derived",
        "artifact_type": "json",
        "required": true,
        "json_pointer": null,
        "section_hint": null,
        "role": "evidence",
        "source_status": null,
        "notes": "Source artifact for retrospective WorkTrace reconstruction."
      },
      {
        "path": "outputs/claim_trace_matrix.json",
        "exists": true,
        "evidence_type": "artifact_derived",
        "artifact_type": "json",
        "required": true,
        "json_pointer": null,
        "section_hint": null,
        "role": "evidence",
        "source_status": null,
        "notes": "Source artifact for retrospective WorkTrace reconstruction."
      },
      {
        "path": "outputs/human_approval_record.json",
        "exists": true,
        "evidence_type": "artifact_derived",
        "artifact_type": "json",
        "required": true,
        "json_pointer": null,
        "section_hint": null,
        "role": "evidence",
        "source_status": null,
        "notes": "Source artifact for retrospective WorkTrace reconstruction."
      },
      {
        "path": "outputs/two_stage_compliance_validation_report.json",
        "exists": true,
        "evidence_type": "artifact_derived",
        "artifact_type": "json",
        "required": true,
        "json_pointer": null,
        "section_hint": null,
        "role": "evidence",
        "source_status": null,
        "notes": "Source artifact for retrospective WorkTrace reconstruction."
      },
      {
        "path": "outputs/workflow_metrics_report.json",
        "exists": true,
        "evidence_type": "artifact_derived",
        "artifact_type": "json",
        "required": true,
        "json_pointer": null,
        "section_hint": null,
        "role": "evidence",
        "source_status": null,
        "notes": "Source artifact for retrospective WorkTrace reconstruction."
      }
    ]
  },
  "nodes": [
    {
      "node_id": "step_01_standard_product_brief_input",
      "sequence": 1,
      "node_name": "Standard Product Brief Input",
      "node_type": "input_artifact",
      "status": "needs_review",
      "time_status": "historical_not_available",
      "started_at": null,
      "completed_at": null,
      "duration_ms": null,
      "input_refs": [
        {
          "path": "docs/product_brief_input_template.md",
          "exists": true,
          "evidence_type": "artifact_derived",
          "artifact_type": "markdown",
          "required": true,
          "json_pointer": null,
          "section_hint": null,
          "role": "input",
          "source_status": null,
          "notes": "File existence checked; existence does not prove business approval."
        }
      ],
      "output_refs": [
        {
          "path": "data/sample_brief.json",
          "exists": true,
          "evidence_type": "artifact_derived",
          "artifact_type": "json",
          "required": true,
          "json_pointer": null,
          "section_hint": null,
          "role": "output",
          "source_status": null,
          "notes": "File existence checked; existence does not prove business approval."
        }
      ],
      "risk_ids": [
        "risk_hd_360_image_quality_requires_formal_proof",
        "risk_stabilization_claim_requires_test_conditions",
        "risk_waterproof_durability_requires_rating_and_limits",
        "risk_ai_auto_editing_effect_requires_scope_limits",
        "risk_required_product_app_scene_assets_need_authorization",
        "risk_logo_portrait_and_scene_materials_need_rights_clearance",
        "risk_forbidden_expression_competitor_and_negative_constraints",
        "risk_growth_metrics_must_not_be_result_promises"
      ],
      "claim_ids": [
        "claim_product_capability_001",
        "claim_product_capability_002",
        "claim_product_capability_003",
        "claim_product_capability_004",
        "claim_ai_capability_001",
        "claim_usage_scenario_001",
        "claim_usage_scenario_002",
        "claim_visual_asset_authorization_001",
        "claim_visual_asset_authorization_002",
        "claim_visual_asset_authorization_003",
        "claim_compliance_or_safety_001",
        "claim_compliance_or_safety_002",
        "claim_growth_or_business_outcome_001"
      ],
      "retry_count": null,
      "retry_count_status": "historical_not_available",
      "error": null,
      "human_approval": null,
      "next_node": "step_02_workflow_schema_io_contract_specification"
    },
    {
      "node_id": "step_02_workflow_schema_io_contract_specification",
      "sequence": 2,
      "node_name": "Workflow / Schema / I/O Contract Specification",
      "node_type": "specification",
      "status": "pass",
      "time_status": "historical_not_available",
      "started_at": null,
      "completed_at": null,
      "duration_ms": null,
      "input_refs": [
        {
          "path": "data/sample_brief.json",
          "exists": true,
          "evidence_type": "artifact_derived",
          "artifact_type": "json",
          "required": true,
          "json_pointer": null,
          "section_hint": null,
          "role": "input",
          "source_status": null,
          "notes": "File existence checked; existence does not prove business approval."
        }
      ],
      "output_refs": [
        {
          "path": "schemas/product_brief.schema.json",
          "exists": true,
          "evidence_type": "artifact_derived",
          "artifact_type": "json",
          "required": true,
          "json_pointer": null,
          "section_hint": null,
          "role": "output",
          "source_status": null,
          "notes": "File existence checked; existence does not prove business approval."
        },
        {
          "path": "workflow/agent_workflow.md",
          "exists": true,
          "evidence_type": "artifact_derived",
          "artifact_type": "markdown",
          "required": true,
          "json_pointer": null,
          "section_hint": null,
          "role": "output",
          "source_status": null,
          "notes": "File existence checked; existence does not prove business approval."
        },
        {
          "path": "workflow/agent_io_contracts.md",
          "exists": true,
          "evidence_type": "artifact_derived",
          "artifact_type": "markdown",
          "required": true,
          "json_pointer": null,
          "section_hint": null,
          "role": "output",
          "source_status": null,
          "notes": "File existence checked; existence does not prove business approval."
        }
      ],
      "risk_ids": [],
      "claim_ids": [],
      "retry_count": null,
      "retry_count_status": "historical_not_available",
      "error": null,
      "human_approval": null,
      "next_node": "step_03_brief_parser_agent"
    },
    {
      "node_id": "step_03_brief_parser_agent",
      "sequence": 3,
      "node_name": "Brief Parser Agent",
      "node_type": "agent",
      "status": "needs_review",
      "time_status": "historical_not_available",
      "started_at": null,
      "completed_at": null,
      "duration_ms": null,
      "input_refs": [
        {
          "path": "data/sample_brief.json",
          "exists": true,
          "evidence_type": "artifact_derived",
          "artifact_type": "json",
          "required": true,
          "json_pointer": null,
          "section_hint": null,
          "role": "input",
          "source_status": null,
          "notes": "File existence checked; existence does not prove business approval."
        },
        {
          "path": "schemas/product_brief.schema.json",
          "exists": true,
          "evidence_type": "artifact_derived",
          "artifact_type": "json",
          "required": true,
          "json_pointer": null,
          "section_hint": null,
          "role": "input",
          "source_status": null,
          "notes": "File existence checked; existence does not prove business approval."
        },
        {
          "path": "prompts/brief_parser.md",
          "exists": true,
          "evidence_type": "artifact_derived",
          "artifact_type": "markdown",
          "required": true,
          "json_pointer": null,
          "section_hint": null,
          "role": "input",
          "source_status": null,